Headline,Description,Date,Link
World Bank says recession will be ‘hard to avoid’ for many countries,"You can add the World Bank to the growing chorus sounding recession alarm bells. In its latest outlook, World Bank president David Malpass said “for many countries, recession will be hard to avoid.”","Jun 08, 2022",https://www.cnn.com/2022/06/07/economy/world-bank-recession/index.html
The stock market could soon see a massive change to how it functions,The agency that oversees Wall Street is weighing major changes to the way millions of everyday investors buy and sell stocks. That could be bad news for so-called free-trading apps like Robinhood as well as the lesser known firms that underpin their ...,"Jun 08, 2022",https://www.cnn.com/2022/06/07/investing/sec-retail-investors-payment-for-order-flow/index.html
Britain’s economy is in a bad place. Removing Boris Johnson might help,"Investors don’t usually like political uncertainty. But in the United Kingdom, a shake-up in government could be exactly what the economy needs.","Jun 07, 2022",https://www.cnn.com/2022/06/06/business/boris-johnson-vote-uk-economy/index.html
‘Uninvestable’ China could make a comeback,"Foreign investors lost their nerve on parking money in China over the past year, as Beijing cracked down on the country’s biggest tech companies, the real estate sector stumbled and coronavirus lockdowns crimped growth.","Jun 07, 2022",https://www.cnn.com/2022/06/07/investing/premarket-stocks-trading/index.html
Stocks are itching for a turnaround. This won’t help,"Late last week, Microsoft — the second largest public company in the United States — leveled with its investors. Earnings for the current quarter, it warned, would not be as strong as it had hoped.","Jun 06, 2022",https://www.cnn.com/2022/06/06/investing/premarket-stocks-trading/index.html
Amazon is closing its Kindle store in China,"Amazon is shutting down its Kindle bookstore in China, marking another retreat by a Western tech giant in the world’s second biggest economy.","Jun 04, 2022",https://www.cnn.com/2022/06/03/tech/amazon-closing-kindle-store-china-intl-hnk/index.html
The economy is going into the toilet. Let’s hope no one flushes it!,"JPMorgan Chase CEO Jamie Dimon says an economic hurricane is coming. Tesla’s Elon Musk says he has a “super bad feeling” about a recession. Companies are downgrading their earnings forecasts. Oh, and we’re in the midst of an energy and ...","Jun 04, 2022",https://www.cnn.com/2022/06/03/economy/economy-jobs/index.html
Biden brushes off Elon Musk’s warnings about the economy while touting May jobs report,"President Joe Biden on Friday brushed off economic warnings from Tesla CEO Elon Musk and JPMorgan Chase CEO Jamie Dimon as he touted May’s jobs report, saying the nation is likely to see more moderate gains as his administration struggles to ...","Jun 03, 2022",https://www.cnn.com/2022/06/03/politics/biden-economy-may-jobs/index.html
3 signs that the US economy is already losing steam,Fears about whether America could fall into a recession are dominating conversations among investors and pose a risk to the Biden administration ahead of midterm elections this fall.,"Jun 03, 2022",https://www.cnn.com/2022/06/03/investing/premarket-stocks-trading/index.html
"Elon Musk has ‘super bad feeling’ about economy, wants to slash Tesla jobs","Tesla CEO Elon Musk has a “super bad feeling” about the economy and wants to cut about 10% of jobs at the electric carmaker, he said in an email to executives on Thursday seen by Reuters.","Jun 03, 2022",https://www.cnn.com/2022/06/03/tech/elon-musk-tesla-jobs-economy/index.html
Opinion: Small businesses like mine are struggling to deal with rising prices for almost everything,"Small businesses are the fabric of this country, employing and improving communities across the nation, and we need them to be successful. We can’t relive the inflationary times of the late ’70s and early ‘80s.","Jun 02, 2022",https://www.cnn.com/2022/06/02/perspectives/inflation-liberty-landscape-supply/index.html
$2 trillion in savings may not rescue the economy,The CEO of the biggest US bank estimates that Americans are still sitting on $2 trillion in pandemic-era savings that can power the economy even as inflation bites. But what happens once that stash of cash is diminished?,"Jun 02, 2022",https://www.cnn.com/2022/06/02/investing/premarket-stocks-trading/index.html
"From Elon Musk to the Feds, ‘sustainable’ investments are under fire","Investors have been increasingly eager in recent years to deploy their money in a way that supports sustainability and aligns with their values — a trend that, in theory, could leverage capitalism to help combat climate change and fight society’s ills.","Jun 01, 2022",https://www.cnn.com/2022/06/01/investing/premarket-stocks-trading/index.html
Shanghai aims for business as usual but hurdles remain,"China’s richest and most international city is trying to return to business as usual after a two-month lockdown, but some restrictions will remain in place.","Jun 01, 2022",https://www.cnn.com/2022/05/30/business/china-shanghai-covid-reopening-businesses-intl-hnk/index.html
It turns out money may buy some happiness,"For his podcast, “Margins of Error,” CNN’s Harry Enten went to some different sources to determine whether money can buy happiness. Here is what he found.","May 28, 2022",https://www.cnn.com/2022/05/28/health/money-happiness-wellness/index.html
Opinion: It’s time to prepare for a recession,"There is a toxic brew of external economic headwinds, including the war in Ukraine and Covid lockdowns in China, resulting in supply shocks that boost inflation and slow growth.","May 27, 2022",https://www.cnn.com/2022/05/26/perspectives/recession-gdp-fed-inflation/index.html
Wealthy shoppers are splurging at Macy’s. Low-income shoppers are pulling back at Walmart,Decades-high inflation is leading to a split in American consumers’ behavior.,"May 26, 2022",https://www.cnn.com/2022/05/26/business/macys-nordstrom-department-stores/index.html
"Chinese consumers are stuck at home but still spending a ton, Alibaba says",China’s economy has slumped as Covid cases surged in the world’s most populous country. But Chinese consumers stuck at home are still spending.,"May 26, 2022",https://www.cnn.com/2022/05/26/investing/alibaba-earnings/index.html
The US economy shrank slightly faster in the first quarter,"America’s economy shrank at a slightly faster rate than initially reported in the first quarter of the year, the Bureau of Economic Analysis said Thursday.","May 26, 2022",https://www.cnn.com/2022/05/26/economy/us-economy-gdp-revision/index.html
"100,000 Chinese officials attend emergency meeting to revive Covid-hit economy","China’s cabinet held an emergency meeting with more than 100,000 participants on Wednesday, according to state media, as top leaders urged new measures to stabilize an economy battered by the country’s stringent Covid-19 restrictions.","May 26, 2022",https://www.cnn.com/2022/05/26/business/china-state-council-economic-meeting-intl-hnk/index.html
Luckin Coffee is back and bigger than Starbucks in China,"Luckin Coffee, the Chinese startup that became mired in a fraud scandal and was kicked off Wall Street two years ago, is making a comeback.","May 26, 2022",https://www.cnn.com/2022/05/25/investing/china-luckin-coffee-earnings-q1-2022-intl-hnk/index.html
Could this Google-backed startup become Africa’s answer to Airbnb?,The company aims to encourage travel within the African continent.,"May 25, 2022",https://www.cnn.com/travel/article/bongalo-airbnb-africa-mobile-money-spc-intl/index.html
This is globalization in reverse,"If globalization was supposed to bring the world and its economies together, “fragmentation” is the term for how they’re splintering apart. McDonald’s pulling out of Russia is a good example of the seeming end of cross-border openness. ...","May 25, 2022",https://www.cnn.com/2022/05/24/politics/globalization-trade-tariffs-what-matters/index.html
Is the summer vacation boom over before it even began?,This summer has long been forecast as a potential boom time for the travel industry. Retailers and economists have been talking a lot about how consumers are starting to buy less stuff and are instead spending more on vacations and other experiences.,"May 24, 2022",https://www.cnn.com/2022/05/24/investing/travel-stocks-economy-covid-inflation/index.html
"Globalization is coming undone, and that’s a huge red flag","One of the many buzzwords percolating around Davos this week is “fragmentation,” the force economists there warned could have “devastating human consequences.”","May 24, 2022",https://www.cnn.com/2022/05/24/investing/premarket-stocks-trading/index.html
‘Lunchflation’ is real. Returning to the office is costing us a fortune,"As more people return to the office, they’re being greeted by much higher prices for just about everything.","May 24, 2022",https://www.cnn.com/2022/05/24/success/return-to-office-inflation/index.html
Airbnb is closing its listings business in China,"Airbnb will shut down its listings in China after two years of lockdowns in the country “with no end in sight,” according to a source familiar with the matter.","May 24, 2022",https://www.cnn.com/2022/05/24/business/airbnb-china-closure-zero-covid-intl-hnk/index.html
"Before Omicron, inflation and war, Americans’ finances hit new highs, survey shows","Things were looking up for most Americans by the end of last year, with many households reporting their financial situation was better than at any time since 2013.","May 24, 2022",https://www.cnn.com/2022/05/23/economy/americans-economic-well-being-2021-report/index.html
Global economy faces ‘its biggest test’ since WWII,The global economy is being brought to the edge of a precipice by crisis upon crisis.,"May 23, 2022",https://www.cnn.com/2022/05/23/business/davos-global-economy-imf/index.html
The bull market minted millions of day traders. They’re in for a rough ride,"For traders who’ve only known the thrill of the bull market, 2022 has been a harsh pivot. On the WallStreetBets page — the epicenter of the 2021 meme stock mania — the mood is decidedly less party-like. The rally cries of “diamond hands” and ...","May 23, 2022",https://www.cnn.com/2022/05/23/investing/premarket-stocks-trading/index.html
China slashes key interest rate as housing sales collapse,China on Friday slashed a key interest rate to rescue its slumping housing market and head off a major downturn in the world’s second largest economy.,"May 21, 2022",https://www.cnn.com/2022/05/20/economy/china-record-lpr-cut-property-market-intl-hnk/index.html
"Plunging stocks, recession fears. Here’s how to protect your money",,"May 19, 2022",https://www.cnn.com/2022/05/19/success/money-moves-stock-rout-recession-fears-feseries/index.html
Global markets slide after a tough day on Wall Street,"Asian markets mostly closed lower and European indexes slid in early trade on Thursday, continuing Wall Street’s downward spiral hours earlier.","May 19, 2022",https://www.cnn.com/2022/05/18/investing/global-markets-intl-hnk/index.html
Retailers just sounded an alarm on inflation. It’s worth heeding,"Shares of retailers were pummeled on Wednesday as investors dug through the latest earnings results from Target and Walmart, which were flush with signs that the economy is entering a period of deep uncertainty.","May 19, 2022",https://www.cnn.com/2022/05/19/investing/premarket-stocks-trading/index.html
Burberry reports record profit despite a slowdown in its biggest market,"Burberry reported record profits for the year ended in April despite taking a recent sales hit from its biggest market, China.","May 18, 2022",https://www.cnn.com/2022/05/18/investing/burberry-earnings-record-profit-china/index.html
China tries to make nice with Big Tech as economic challenges mount,China is trying once again to lift the spirits of its huge tech industry after a bruising regulatory offensive that has weakened some of its biggest businesses at a time of stalling economic growth.,"May 18, 2022",https://www.cnn.com/2022/05/18/tech/china-vice-premier-pledges-support-tech-sector-intl-hnk/index.html
No cars were sold in Shanghai in April as zero-Covid policy hammers activity,Shanghai posted zero car sales last month as China pressed ahead with its stringent pandemic control measures.,"May 17, 2022",https://www.cnn.com/2022/05/17/cars/shanghai-car-sales-zero-april-2022-intl-hnk/index.html
Covid has hit China’s economy harder than expected,"China has reported disappointing economic data for the month of April, underscoring the extensive damage Covid lockdowns have wreaked on the country.","May 16, 2022",https://www.cnn.com/2022/05/16/economy/china-economic-toll-zero-covid-policy-intl-hnk/index.html
Top dealmaker says Chinese markets are ‘close to the bottom’,One of China’s top investment bankers says the country’s stock markets appear to be nearing “the bottom.”,"May 16, 2022",https://www.cnn.com/2022/05/16/investing/chinese-stock-markets-renaissance-ceo-intl-hnk/index.html
How resilient is the US consumer?,"Worries about an economic slowdown are running wild on Wall Street. Despite concerns about inflation, higher interest rates from the Federal Reserve, supply chain issues and geopolitical turmoil due to Russia’s invasion of Ukraine and Covid ...","May 15, 2022",https://www.cnn.com/2022/05/15/investing/stocks-week-ahead/index.html
Why people hated shopping carts when they first came out,"We live in a world shaped by shopping carts. The ubiquitous, unloved contraptions are a key feature of US economy. (Yes, really.)","May 14, 2022",https://www.cnn.com/2022/05/14/business/grocery-shopping-carts-history/index.html
Consumers are feeling worse about the economy again,Americans are feeling worse about the state of the economy again and it’s all because of rampant inflation.,"May 13, 2022",https://www.cnn.com/2022/05/13/economy/may-consumer-sentiment-inflation/index.html
Not all recessions are the same. Here’s what could happen to the economy and markets,"Economists, CEOs, Wall Street and Main Street are sounding the recession alarm bell.","May 12, 2022",https://www.cnn.com/2022/05/12/investing/recession-shapes-alphabet/index.html
Opinion: The bad news about the economy,"Advocates of so-called modern monetary theory told us not to worry, on the dubious idea that we could print money without inflationary consequence — or at least we’d know just what to do if inflation started to rise. Well, it’s far past time to worry, ...","May 12, 2022",https://www.cnn.com/2022/05/12/opinions/the-bad-news-about-economy-sachs/index.html
How China’s lockdowns are taking a toll on global companies,Virtually every corner of business has been disrupted in China as harsh lockdowns continue across the world’s second largest economy. Now big brands are revealing the damage to their bottom lines.,"May 10, 2022",https://www.cnn.com/2022/05/10/business/china-covid-lockdowns-impact-global-business-intl-hnk/index.html
"Biden doesn’t have a silver bullet for inflation, but here’s what he can do","I can’t remember a more difficult, complicated set of factors at play all at once in the economy – with no road map.","May 10, 2022",https://www.cnn.com/2022/05/10/economy/joe-biden-inflation/index.html
Foreign business urges China to change course on Covid,"Groups representing Western businesses in China are urging Beijing to relax its approach to Covid, saying harsh lockdowns are damaging earnings and investment and forcing a growing number of companies to consider shifting operations out of ...","May 09, 2022",https://www.cnn.com/2022/05/09/business/us-european-business-china-zero-covid-intl-hnk/index.html
How to beat inflation: Buy what you know — and what you eat,"The stock market is a mess right now, but here’s some Wall Street wisdom for these tough times: Eat, drink and be merry. Emphasis on the merry if you’ve been buying food and beverage stocks.","May 09, 2022",https://www.cnn.com/2022/05/09/investing/food-stocks-inflation-economy/index.html
"China faces ‘complex and grave’ job market, warns Premier Li","One of China’s top leaders has painted a grim picture of the job market in the world’s most populous nation, as widespread Covid lockdowns slam the brakes on the economy.","May 09, 2022",https://www.cnn.com/2022/05/09/economy/china-li-keqiang-jobs-grave-situation-l-intl-hnk/index.html
"The stock market is afraid, but there are pockets of strength if you know where to look","Investors are very nervous about what’s next for America’s economy, with market fear gauges spiking. But there are still some bright spots for investors seeking companies that may still report healthy earnings even in a further-weakened economy.","May 07, 2022",https://www.cnn.com/2022/05/06/investing/stocks-earnings-economy/index.html
Adidas reports nearly 40% drop in profits. Here’s why,Adidas on Friday blamed poor sales in China for a sharp drop in first quarter profit.,"May 06, 2022",https://www.cnn.com/2022/05/06/investing/adidas-q1-profit-china/index.html
Global markets rattled by Wall Street and China’s zero-Covid pledge,Global markets slid Friday after Wall Street suffered its worst day of the year.,"May 06, 2022",https://www.cnn.com/2022/05/06/investing/global-markets-intl-hnk/index.html
A feeling of economic doom is going around. And there isn’t much we can do other than sit back and watch,"There’s plenty of reason for that feeling of economic doom, from the highest inflation in 40-plus years to the dimmest public view of the US economy in 10-plus years, according to a new poll. And there’s very little President Joe Biden can do but sit ...","May 06, 2022",https://www.cnn.com/2022/05/05/politics/economy-inflation-woes-what-matters/index.html
More bad news for Biden: More Americans are blaming him for the state of the economy,"The story of public opinion ahead of the 2022 midterms is an easy one to understand: “It’s the economy, stupid,” and unless the economy improves, President Joe Biden and the Democrats are in major trouble, Harry Enten writes.","May 05, 2022",https://www.cnn.com/2022/05/05/politics/biden-economy-midterms-poll-blame/index.html
China’s economy is going backwards,China’s gigantic services sector just contracted at the second sharpest pace on record as Covid lockdowns hit businesses hard.,"May 05, 2022",https://www.cnn.com/2022/05/05/economy/china-economy-services-decline-covid-intl-hnk/index.html
Biden is close to the point of no return with Americans on the economy,President Joe Biden and his administration appear perilously close to an irreversible severing of public confidence in his capacity to deliver prosperity and financial security as stiff economic challenges balloon into huge political liabilities.,"May 05, 2022",https://www.cnn.com/2022/05/05/politics/biden-economy-analysis/index.html
Shell posts record quarterly profit of $9 billion,"Shell on Thursday reported a record first-quarter profit of $9.13 billion, boosted by higher oil and gas prices, stellar refining profits and the strong performance of its trading division.","May 05, 2022",https://www.cnn.com/2022/05/05/investing/shell-earnings-record-profit/index.html
CNN Poll: Most Americans have a dismal view of the US economy,"The US public’s view of the nation’s economy is the worst it’s been in a decade, a new CNN Poll conducted by SSRS finds, with many Americans also saying they feel financial strain in their own lives.","May 05, 2022",https://www.cnn.com/2022/05/04/politics/cnn-poll-economy-biden-approval/index.html
China market analyst out after his social media accounts were frozen,"Hong Hao, a prominent market analyst in China, has left the state-owned bank he worked for just days after his social media accounts were shut down following downbeat remarks he made about the economy.","May 04, 2022",https://www.cnn.com/2022/05/04/investing/hong-hao-resign-bocom-international-intl-hnk/index.html
"Opinion: The GDP report isn’t as bad as it seems, but there are still economic risks ahead","Renewed Covid-19 outbreaks in China have resulted in lockdowns that could reverse progress in global supply chains. Additionally, the war in Ukraine has the potential to spiral even further out of control, driving food and energy prices even higher.","May 03, 2022",https://www.cnn.com/2022/05/03/perspectives/gdp-report-economy-risks/index.html
BP profit more than doubles on ‘exceptional’ oil trading,BP took a hit of more than $24 billion from ditching its business in Russia but reported a huge jump in profit for the first quarter.,"May 03, 2022",https://www.cnn.com/2022/05/03/investing/bp-earnings-russia/index.html
China silences prominent market analyst as economic slump deepens,Chinese social media have shut down the accounts of a prominent market analyst who drew attention in recent weeks to the dramatic slowdown in the country’s economy and the effects of government policy on the tech industry.,"May 02, 2022",https://www.cnn.com/2022/05/02/investing/hong-hao-social-media-banned-china-intl-hnk/index.html
Investing ethically won’t buy protection in this market,"As the economy began bouncing back from the coronavirus pandemic, interest in investment products that promoted good environmental, social and governance practices took off.","May 02, 2022",https://www.cnn.com/2022/05/02/investing/premarket-stocks-trading/index.html
"America will recover all jobs lost during Covid by this summer, Fitch says",The United States is rapidly approaching a major jobs milestone that highlights the historically strong economic recovery from Covid-19.,"May 02, 2022",https://www.cnn.com/2022/05/02/economy/jobs-economy-covid/index.html
Amazon stock plunges as growth slows,Amazon’s stock plummeted after the company reported on Thursday slowing growth and higher costs in its latest quarter and offered a disappointing revenue outlook.,"Apr 29, 2022",https://www.cnn.com/2022/04/28/tech/amazon-earnings-loss/index.html
Apple loses top spot in China as smartphone sales slump,"Just three months ago, Apple became the top-selling smartphone brand in China for the first time in six years. Now it’s fallen back behind its Chinese rivals after suffering more than others from a first quarter slump in sales.","Apr 29, 2022",https://www.cnn.com/2022/04/29/tech/apple-china-smartphone-sales-intl-hnk/index.html
ExxonMobil took a $3.4 billion hit for exiting Russia. Its profit still soared,"ExxonMobil took at $3.4 billion charge for exiting its business in Russia in the first quarter, but it still posted sharply higher profits on high oil prices","Apr 29, 2022",https://www.cnn.com/2022/04/29/energy/oil-earnings/index.html
Much of Europe is facing stagflation. France is already there,The European economy slowed in the first three months of the year due to a combination of soaring inflation and early fallout from the war in Ukraine.,"Apr 29, 2022",https://www.cnn.com/2022/04/29/economy/europe-economy-gdp-inflation/index.html
Recession fears are mounting. Here’s how to protect your money,Warnings of a potential recession on the horizon aren’t surprising given how many tripwires there are in today’s economy.,"Apr 28, 2022",https://www.cnn.com/2022/04/28/success/money-moves-recession-geopolitical-unrest/index.html
The US economy shrank in the first quarter,"America’s economy unexpectedly shrank in the first quarter of 2022, data from the Bureau of Economic Analysis showed Thursday.","Apr 28, 2022",https://www.cnn.com/2022/04/28/economy/us-economy-first-quarter-gdp/index.html
The US economy contracted. Don’t panic,"The economic recovery from Covid-19 stumbled in the first quarter, but that doesn’t mean a recession is imminent.","Apr 28, 2022",https://www.cnn.com/2022/04/28/business/gdp-recession-indicators/index.html
Meta earnings and the metric Wall Street is obsessing over,"Every quarter, investors on Wall Street parse earnings for intel on how much money a company brings in and the size of its profit.","Apr 28, 2022",https://www.cnn.com/2022/04/28/investing/premarket-stocks-trading/index.html
China’s Xi calls for ‘all-out’ infrastructure splurge to rescue economy,China is about to embark on a new infrastructure spending spree in a bid to fix an economy nearing breaking point because of Covid lockdowns.,"Apr 28, 2022",https://www.cnn.com/2022/04/27/economy/china-xi-infrastructure-push-covid-lockdowns-intl-hnk/index.html
Southwest is set to return to profitability,"Southwest Airlines posted a first-quarter loss, but the company said that will be the last time it loses money for awhile.","Apr 28, 2022",https://www.cnn.com/2022/04/28/business/southwest-earnings/index.html
Biden will tout ‘small business boom’ in roundtable with small business owners at White House,"The Biden administration will release a report Thursday touting what it’s calling a “small business boom” under its watch, while hitting Republicans for policies it warns would “increase taxes on small businesses across the country.”","Apr 28, 2022",https://www.cnn.com/2022/04/28/politics/small-business-roundtable-white-house-biden/index.html
Major tech antitrust bill gets backing of US Commerce Department,"The Commerce Department backed a key legislative proposal aimed at forcing tech giants such as Facebook and Google to compete against smaller businesses, agency secretary Gina Raimondo said Wednesday, in an announcement that throws the full ...","Apr 27, 2022",https://www.cnn.com/2022/04/27/tech/commerce-antitrust-bill/index.html
Why lab-grown diamond sales are surging,,"Apr 27, 2022",https://www.cnn.com/2022/04/27/business/diamonds-manmade-demand/index.html
