Headline,Description,Date,Link
UPS earnings fall as company warns of economic headwinds ahead,"UPS reported sharply lower earnings in the third quarter and said it expects lower revenue and thinner profit margins ahead, but it noted a slowing global economy, not its recent labor issues, is the reason.","Oct 26, 2023",https://www.cnn.com/2023/10/26/business/ups-earnings-fall-sees-economic-headwinds-ahead/index.html
Big Tech earnings can make or break this market,"In an unstable economic climate marked by geopolitical unrest, concerns about the Federal Reserve and soaring Treasury yields, investors are closely watching this week’s Big Tech earnings for clues about where the volatile stock market may head ...","Oct 25, 2023",https://www.cnn.com/2023/10/25/investing/premarket-stocks-trading/index.html
"After a robust third quarter, US economic growth will likely slow. That bodes well for rate cuts next year.","The Commerce Department is set to report third-quarter gross domestic product Thursday. It’s the broadest measure of economic output, and it’ll likely show that the US economy expanded at a staggeringly rapid pace from July through September, ...","Oct 22, 2023",https://www.cnn.com/2023/10/22/economy/stocks-week-ahead-q3-gdp/index.html
What the Israel-Hamas war means for US markets,Growing unrest in the Middle East has cast a shadow on global financial markets.,"Oct 17, 2023",https://www.cnn.com/2023/10/17/investing/premarket-stocks-trading/index.html
"China’s narrowing trade slump boosts recovery prospects, but challenges persist","China’s exports and imports shrank at a slower pace for a second month in September, customs data showed on Friday, adding to the recent signs of a gradual stabilization in the world’s second-biggest economy thanks to a raft of policy ...","Oct 13, 2023",https://www.cnn.com/2023/10/13/economy/china-trade-september-hnk-intl/index.html
How genAI is revolutionizing the field of economics,"Anton Korinek, an economics professor at the University of Virginia, tells the students he advises nowadays that they should really begin to master a flourishing technology expected to transform the field of economics. That technology is generative ...","Oct 12, 2023",https://www.cnn.com/2023/10/12/economy/ai-impact-on-economists-jobs/index.html
Shop these 25 small-business deals before Amazon Prime Day 2023 ends,"Support small businesses during Amazon’s October Prime Day with savings on coffee, candles and more.","Oct 12, 2023",https://www.cnn.com/cnn-underscored/deals/best-small-business-deals-amazon-prime-day-2023-10-11
Janet Yellen sees limited economic impact from war in Israel,"The war between Israel and Hamas is unlikely to have a significant impact on the global economy, US Treasury Secretary Janet Yellen said Wednesday.","Oct 11, 2023",https://www.cnn.com/2023/10/11/economy/janet-yellen-israel-hamas-economy/index.html
Samsung flags 78% profit drop as chip demand remains weak,Samsung warned that operating profit in the third quarter likely plunged 78% as it continues to contend with lower than usual demand for consumer devices.,"Oct 11, 2023",https://www.cnn.com/2023/10/11/tech/samsung-earnings-guidance-q3-2023-intl-hnk/index.html
The IMF sees greater chance of a ‘soft landing’ for the global economy,"The International Monetary Fund (IMF) sees better odds that central banks will manage to tame inflation without tipping the global economy into recession, but it warned Tuesday that growth remained weak and patchy.","Oct 10, 2023",https://www.cnn.com/2023/10/10/economy/imf-world-economic-outlook/index.html
"US economy added 336,000 jobs last month, almost twice what was expected","Fall is here, pumpkin spice lattes are flowing, and in some states, there’s a bite in the air from the first cold snap of the season. But not for the US jobs market: September was a scorcher.","Oct 06, 2023",https://www.cnn.com/2023/10/06/economy/september-jobs-report-final/index.html
China’s economy will be hobbled for years by the real estate crisis,"China’s robust growth, one of the fastest sustained expansions for a major economy in history, was propelled for decades by a housing boom fueled by a rising population and urbanization.","Oct 06, 2023",https://www.cnn.com/2023/10/06/economy/china-economy-real-estate-crisis-intl-hnk/index.html
"Two jobs reports, two different views of the labor market","Almost any economist will tell you they don’t have a crystal ball. But using all kinds of fancy (and sometimes not so fancy) models, they make predictions about forthcoming economic data. And oftentimes, economists’ consensus forecasts are spot on.","Oct 05, 2023",https://www.cnn.com/2023/10/04/business/nightcap-jobs-reports-labor-market/index.html
"The private sector added just 89,000 jobs last month, far below expectations","US employers in the private sector added an estimated 89,000 jobs in September, a much lower total than expected and a potential indication of a sharp pullback in the labor market, payroll processor ADP reported Wednesday.","Oct 04, 2023",https://www.cnn.com/2023/10/04/economy/adp-private-jobs-report-september/index.html
ESG has lost its meaning. One advocate says let’s throw it in the trash,"Not so long ago, Wall Street had a particular obsession with ESG investing, which favors companies that promise to make certain strides on the environment, societal impact and corporate governance. Nearly every CEO of a major company touted ...","Oct 03, 2023",https://www.cnn.com/2023/10/03/investing/premarket-stocks-trading/index.html
Corporate America praises the ‘adults’ who averted a government shutdown,Corporate America is breathing a sigh of relief after lawmakers narrowly avoided a chaotic shutdown of the federal government.,"Oct 03, 2023",https://www.cnn.com/2023/10/02/business/government-shutdown-business-economy/index.html
Has China’s economy bottomed out? Factory output and ‘Golden Week’ travel offer glimmers of hope,A return to growth in China’s manufacturing sector and a boom in travel during the annual “Golden Week” holiday is fueling hopes that the economy could be regaining momentum after a major slowdown this year.,"Oct 02, 2023",https://www.cnn.com/2023/10/02/economy/china-pmi-travel-boom-golden-week-intl-hnk/index.html
Analysis: A government shutdown is the last thing the economy needs,It’s a delicate time for the American economy.,"Sep 28, 2023",https://www.cnn.com/2023/09/28/economy/us-government-shutdown-last-thing-the-economy-needs/index.html
US consumer spending was much weaker in the second quarter than previously estimated,"The Commerce Department’s final revision of second-quarter gross domestic product, the broadest measure of economic output, showed that economic growth was unchanged from the second estimate, holding at an annualized rate of 2.1%.","Sep 28, 2023",https://www.cnn.com/2023/09/28/economy/q2-gdp-final-estimate/index.html
"On GOP debate stage, a sometimes oversimplified view of China’s economy",Florida Gov. Ron DeSantis called for “decoupling” the US economy from China. Vivek Ramaswamy said: “We need to declare independence from China.” And North Dakota Gov. Doug Burgum said the US is “in a cold war with China.”,"Sep 28, 2023",https://www.cnn.com/2023/09/28/economy/debate-republicans-us-china-economy/index.html
London is suffering an office ‘recession.’ Meta just paid $181 million to dump a lease,"London’s office market has plunged into a “rental recession,” with the share of empty space hitting its highest level in three decades, investment bank Jefferies said in a note Wednesday.","Sep 27, 2023",https://www.cnn.com/2023/09/27/economy/london-office-market-recession-meta-lease/index.html
AI deals give investment banks a glimmer of hope,Dealmaking on Wall Street hit a dead end last year and has struggled ever since.,"Sep 26, 2023",https://www.cnn.com/2023/09/26/investing/premarket-stocks-trading/index.html
China and Europe try to dial down trade tension,China and the European Union have agreed to exchange information on export controls as part of efforts to dial down tension over trade imbalances and geopolitical issues.,"Sep 26, 2023",https://www.cnn.com/2023/09/26/business/eu-china-trade-valdis-dombrovskis-visit-intl-hnk/index.html
Amazon invests up to $4 billion in Anthropic AI in exchange for minority stake and further AWS integration,"Amazon said on Monday that it’s investing up to $4 billion into the artificial intelligence company Anthropic in exchange for partial ownership and Anthropic’s greater use of Amazon Web Services (AWS), the e-commerce giant’s cloud ...","Sep 25, 2023",https://www.cnn.com/2023/09/25/tech/amazon-invests-anthropic-ai/index.html
"Consumers are still spending on nice things, if they’re on trend","American consumers aren’t tired of shopping. They’re shopping more prudently, with an eye on getting the best value, sure. But they’re also rewarding the stores that are betting big on the right trends at the right time, for the right price.","Sep 25, 2023",https://www.cnn.com/2023/09/25/business/brands-capturing-consumer-spending/index.html
Europe’s trade chief promises more ‘assertive’ approach to China as deficit soars,"China’s unfair trade practices have forced the European Union to become more assertive in its dealings with the world’s second largest economy, the bloc’s commissioner for trade said Monday during a trip to Beijing.","Sep 25, 2023",https://www.cnn.com/2023/09/25/economy/china-eu-trade-intl-hnk/index.html
The very rich are often bad investors. Here’s why,It’s pretty easy to squander vast sums of money. Just ask the descendants of the wealthiest Americans.,"Sep 25, 2023",https://www.cnn.com/2023/09/25/investing/premarket-stocks-trading/index.html
Even the Fed is cutting jobs — for the first time in more than a decade,"Even as Federal Reserve Chair Jerome Powell reassures the public about the state of the US economy, the organization is quietly laying off workers at its own doorstep.","Sep 22, 2023",https://www.cnn.com/2023/09/22/economy/fed-job-cuts-economy/index.html
China relaxes capital controls to entice badly needed foreign investment,"China is allowing foreigners in Shanghai and Beijing to move their money freely into and out of the country, in a significant move toward relaxing its strict capital controls as it tries to woo overseas investors.","Sep 22, 2023",https://www.cnn.com/2023/09/22/economy/china-loosens-capital-controls-intl-hnk/index.html
Banks scramble to find leaders equipped for today’s economic realities,Wall Street has a knowledge hole.,"Sep 19, 2023",https://www.cnn.com/2023/09/19/investing/premarket-stocks-trading/index.html
‘Argentina on the Channel.’ Mark Carney and Liz Truss clash over UK economy,"When Liz Truss was briefly Britain’s prime minister a year ago, the world’s sixth-largest economy came close to resembling Argentina, a country plagued by financial and economic instability.","Sep 18, 2023",https://www.cnn.com/2023/09/18/economy/mark-carney-liz-truss-uk-economy/index.html
Fact check: Debunking eight Trump false claims about the Biden-era economy,"In a campaign speech at a rally in South Dakota on Friday, former President Donald Trump delivered lengthy and detailed criticism of the US economy under President Joe Biden – accusing Biden of deceiving the public on the subject of “Bidenomics.”","Sep 15, 2023",https://www.cnn.com/2023/09/14/politics/fact-check-trump-claims-about-biden-economy/index.html
"US retail spending picked up in August, mostly due to sales at gas stations","US retail sales picked in August, boosted by higher gas prices, as spending on other items grew modestly.","Sep 14, 2023",https://www.cnn.com/2023/09/14/economy/retail-sales-august/index.html
American Airlines makes a drastic cut to profit forecast as fuel prices soar,"American Airlines said that rising costs, including fuel, will dent its upcoming profits.","Sep 13, 2023",https://www.cnn.com/2023/09/13/business/american-airlines-fuel-profit/index.html
Putin lauds ‘excellent’ economic ties with China. Here’s how they’ve grown,"Economic relations between Moscow and Beijing have become very strong, Russia’s president said Tuesday, a year and half after sweeping sanctions dramatically curtailed ties with the West.","Sep 12, 2023",https://www.cnn.com/2023/09/12/business/putin-russia-china-economic-ties/index.html
Inflation woes persist for small businesses as they struggle to hire,"America’s small businesses felt gloomier in August as they continued to struggle with inflation and hiring qualified workers, according to a survey from the National Federation of Independent Business released Tuesday.","Sep 12, 2023",https://www.cnn.com/2023/09/12/economy/nfib-business-optimism-august/index.html
Alibaba’s new CEO embraces AI and wants a younger management team,"Alibaba Group will embrace artificial intelligence (AI) and promote younger people to senior management, its new CEO says, as the e-commerce and cloud giant tackles its most ambitious restructuring in its history.","Sep 12, 2023",https://www.cnn.com/2023/09/12/tech/china-eddie-wu-alibaba-ai-focus-hnk-intl/index.html
China’s ‘Lipstick King’ tearfully apologizes after online spat highlighting country’s economic woes,One of China’s most popular livestreamers has offered a teary apology after getting into a viral online spat in which he questioned whether a viewer had been working “hard enough” to make enough money to afford a product he was selling.,"Sep 12, 2023",https://www.cnn.com/2023/09/12/economy/china-lipstick-king-economy-intl-hnk/index.html
Americans have never been wealthier,"Fueled by a resurgent stock market and rising home values, US household wealth hit a record $154.3 trillion during the second quarter of this year, according to federal data.","Sep 11, 2023",https://www.cnn.com/2023/09/11/economy/household-wealth-economy-stocks/index.html
How booming Vietnam offers the US an alternative to China,President Joe Biden left Vietnam Monday after a visit that deepened economic ties between Washington and Hanoi as part of efforts to reduce America’s reliance on China.,"Sep 11, 2023",https://www.cnn.com/2023/09/11/economy/biden-vietnam-visit-business-ties-intl-hnk/index.html
What China’s new smartphone means for Wall Street,"Stock prices of chipmakers have soared over the last year as AI became the story of 2023. But in recent weeks, there’s been a notable drop in those shares as growing tensions between the US and China cloud their outlook.","Sep 11, 2023",https://www.cnn.com/2023/09/11/investing/premarket-stocks-trading/index.html
America is in a factory boom again. Even a recession may not bring it down this time,"On a warm Saturday morning in July, as Kathie Leonard planned to set out on her boat for a day on the water off the coast of Maine, her phone rang. The call was from the head of the Maine Department of Economic and Community Development, ...","Sep 09, 2023",https://www.cnn.com/2023/09/09/economy/manufacturing-fed-recession/index.html
Why Biden’s strong economy feels so bad to most Americans,What’s the biggest problem with the US economy right now? The vibes are off.,"Sep 08, 2023",https://www.cnn.com/2023/09/07/business/us-economy-biden-approval/index.html
Ukraine says its war-torn economy is beginning to recover,"Ukraine’s gross domestic product grew by 2.2% year-on-year in the first seven months of 2023, the economy ministry said on Wednesday.","Sep 06, 2023",https://www.cnn.com/2023/09/06/economy/ukraine-economy-growing/index.html
Opinion: Here are the jobs AI will impact most,"To get a better sense of the effect AI might have on different industries across the labor market, we reached out to experts in medicine, law, art, retail, film, tech, education and agriculture.","Sep 05, 2023",https://www.cnn.com/2023/09/05/opinions/artificial-intelligence-jobs-labor-market/index.html
The UK economy is bigger than we thought. It still has ‘a growth problem’,"The UK economy recovered from the Covid-19 pandemic much faster than previously thought, according to major revisions of official statistics that have erased Britain’s laggard status overnight.","Sep 04, 2023",https://www.cnn.com/2023/09/04/economy/uk-economy-gdp-revisions/index.html
"In Lululemon and Dollar General earnings, signs of a possible economic split","It’s a tale of two retailers. One reported strong sales on Thursday, while the other warned it may experience a sales decline for the year.","Sep 02, 2023",https://www.cnn.com/2023/09/02/business/lululemon-dollar-general-economy-consumers/index.html
The US economy continued to add jobs at a robust pace last month,The US labor market continues to live its Goldilocks story with healthy job growth but at a far cooler pace than the blockbuster job gains of the past two and a half years.,"Sep 01, 2023",https://www.cnn.com/2023/09/01/economy/jobs-report-august-final/index.html
The US economy grew more slowly in the second quarter than previously estimated,"The US economy grew more slowly in the second quarter than previously estimated — a good sign for the Federal Reserve, which is attempting to cool demand to bring down price increases.","Aug 30, 2023",https://www.cnn.com/2023/08/30/economy/second-estimate-q2-gdp/index.html
Rising labor costs are making AI stocks even more attractive,"About 300 million full-time jobs across the globe could be lost (or greatly diminished) due to the recent boom in artificial intelligence, Goldman Sachs estimates.","Aug 30, 2023",https://www.cnn.com/2023/08/30/investing/premarket-stocks-trading/index.html
"US isn’t trying to hold China’s economy back, says Commerce Secretary Raimondo","The United States is not seeking to decouple from China’s economy or hold it back, Commerce Secretary Gina Raimondo told senior Chinese economic officials Tuesday in Beijing.","Aug 29, 2023",https://www.cnn.com/2023/08/29/business/us-commerce-secretary-raimondo-china-decoupling-intl-hnk/index.html
The Fed is ‘flying blind’ on the economy. Will this week’s jobs data help?,Welcome to jobs week. Investors are eagerly anticipating a slew of news about the health of the US labor market over the next couple of days.,"Aug 28, 2023",https://www.cnn.com/2023/08/28/investing/premarket-stocks-trading/index.html
Consumers are growing slightly more cautious about the economy,Americans’ attitudes toward the US economy appear to be growing more tepid.,"Aug 25, 2023",https://www.cnn.com/2023/08/25/economy/us-consumer-sentiment-august/index.html
Gap reports mixed second quarter and decline in sales across all brands,Gap saw soft sales across all four of its brands in the latest quarter.,"Aug 25, 2023",https://www.cnn.com/2023/08/24/business/gap-earnings-second-quarter/index.html
Is America’s economy really as bad as Republican presidential candidates say it is?,"To hear Republican presidential candidates describe the US economy, you’d think it was in a deep recession, with growth and productivity choked off by President Joe Biden’s policies.","Aug 24, 2023",https://www.cnn.com/2023/08/24/business/gop-debate-economy-biden/index.html
Americans are shopping less. But the US economic engine is still humming,"To hear executives at some of America’s biggest retailers tell it, consumers are strained for cash and buying less stuff, in a troubling sign of a slowing economy. That’s only half true. The consumer appetite that kept the US economy afloat ...","Aug 24, 2023",https://www.cnn.com/2023/08/23/business/nightcap-consumer-spending-us-econ/index.html
Germany’s economy hasn’t looked this weak since the start of the pandemic,"Germany suffered the steepest decline in business activity for more than three years this month, according to survey data published Wednesday, stoking fears that Europe’s biggest economy is falling back into recession.","Aug 23, 2023",https://www.cnn.com/2023/08/23/economy/germany-economy-recession-pmi/index.html
"Shoppers are trading down, even in secondhand purchases","Jitters about the health of the economy aren’t stopping consumers from buying, but they are becoming more value-driven and less picky about what they buy, even when they’re shopping secondhand.","Aug 22, 2023",https://www.cnn.com/2023/08/22/business/secondhand-shoppers-trading-down/index.html
Will Chinese deflation help cure the West’s inflation problem?,The Chinese economy has hit a rough patch. That might be the catalyst needed to finally cure the West of its inflationary woes.,"Aug 22, 2023",https://www.cnn.com/2023/08/22/investing/premarket-stocks-trading/index.html
Goldman Sachs: A government shutdown would be ‘manageable’ for the economy. That’s why it’s likely to happen,Goldman Sachs is warning clients that Washington is on a collision course with its first government shutdown in five years.,"Aug 21, 2023",https://www.cnn.com/2023/08/21/economy/government-shutdown-goldman-sachs-economy/index.html
China disappoints investors with ‘underwhelming’ decision on key interest rate,"China has surprised investors by deciding not to cut an important interest rate that influences mortgages, in a move that economists say will make it tough to revive confidence in the country’s troubled real estate sector which has dragged down ...","Aug 21, 2023",https://www.cnn.com/2023/08/20/economy/china-economy-lpr-cuts-hnk-intl/index.html
The dog days of summer are boom times for divorce. Here’s why it’s tougher in this economy,"Divorce: If you think budgeting and saving are hard in this economy, imagine splitting up in it.","Aug 20, 2023",https://www.cnn.com/2023/08/19/business/divorce-summer-tough-economy-market/index.html
Why stock investors are suddenly so scared,"Many investors are running a sizable profit this year – the S&P 500 is about 14% higher in 2023. But market losses have been piling up over the past month, particularly on growing fears of contagion from an economic slowdown in China. ...","Aug 18, 2023",https://www.cnn.com/2023/08/18/investing/fear-and-greed-investors/index.html
China stops releasing youth unemployment data after it hit consecutive record highs,"China has suspended the release of monthly data on joblessness among young people, after the figure hit consecutive record highs in recent months amid a broader economic slump.","Aug 18, 2023",https://www.cnn.com/2023/08/14/economy/china-economy-july-slowdown-intl-hnk/index.html
The world shed 3.5 million millionaires in 2022 as market losses drained wealth at the top,"Last year, as interest rates rose and inflation stayed stubbornly high, total household wealth declined for the first time since the 2008 financial crisis.","Aug 17, 2023",https://www.cnn.com/2023/08/16/business/millionaire-wealth-report-nightcap/index.html
"21 tips and tools to make your economy class seat more comfortable, according to travel experts","Economy class seats aren’t always the most comfortable. But, that doesn’t mean you have to accept them for face value. Use these tools and tips to make for a more comfortable economy flying experience.","Aug 17, 2023",https://www.cnn.com/cnn-underscored/travel/how-to-make-economy-class-flight-seat-comfortable
‘Ho-hum holiday’ spending expected as shoppers deal with economic cross-currents,"US consumers, trapped in a web of conflicting signals on the health of the economy and how it impacts their ability to shop for extras, might be forced to spend less enthusiastically on a key bucket of discretionary spending – Christmas gifts, ...","Aug 16, 2023",https://www.cnn.com/2023/08/16/business/holiday-sales-2023-forecast-coresight/index.html
Retail earnings this week could say a lot about the state of America’s economy,"Earnings season continues this week with Target, Walmart, TJ Maxx parent company TJX and other high-profile retailers set to release their quarterly results.","Aug 15, 2023",https://www.cnn.com/2023/08/15/investing/premarket-stocks-trading-retail-sales-earnings/index.html
Japan’s economic growth beats forecasts as exports zoom,"Japan’s economy grew much faster than expected in the April to June months, as brisk auto exports and tourist arrivals helped offset the drag from a slowing post-Covid consumer recovery, although global recession prospects cloud the outlook.","Aug 15, 2023",https://www.cnn.com/2023/08/14/economy/japan-economy-q2-hnk-intl/index.html
UK economy records surprise growth. It may not last,"The UK economy grew slightly in the three months to June 30, driven by strong rises in manufacturing and consumer and government spending.","Aug 11, 2023",https://www.cnn.com/2023/08/11/economy/uk-economy-gdp-q2/index.html
US investment curbs deal ‘major blow’ to Chinese startups,"New constraints on US investments in advanced technology in China will exacerbate a slump in deals between the world’s top two economies and deliver a “major blow” to Chinese startups, analysts and investors told CNN Thursday.","Aug 10, 2023",https://www.cnn.com/2023/08/10/investing/us-china-bans-tech-investment-slump-intl-hnk/index.html
How we’re buying perfume could signal how we’re feeling about the economy,"How consumers are feeling about the health of the US economy, and of their own wallets, could be showing up in the way we’re buying one particular indulgence — perfume.","Aug 09, 2023",https://www.cnn.com/2023/08/09/business/perfume-buying-economic-indicator/index.html
China slips into deflation as consumer prices fall for the first time in more than two years,"The Chinese economy has slipped into deflation, with consumer prices falling for the first time in more than two years in another sign of weakening demand.","Aug 09, 2023",https://www.cnn.com/2023/08/09/economy/china-economy-deflation-intl-hnk/index.html
